{
  "$schema": "https://json-schema.org/draft/2020-12/schema",
  "$id": "https://fabric.passioncode.ai/agent-contract/0.1.0/schemas/entitlement.schema.json",
  "title": "Entitlement, entitlement/1 (DEC-0085)",
  "description": "What one signed order entitles one subject to — an organization (org:<orgId>) or one person's estate (personal) — for at most 35 days: a member allowance, a hosting product, a support tier and the paid agents. The issuer signs it with a key its root lists in an entitlement-key-set/1, over the RFC 8785 form of the document without sig (DEC-0043, the register's entitlement/1, DEC-0063). It names no amount, price, currency or person.",
  "type": "object",
  "required": [
    "type",
    "issuer",
    "subject",
    "estate",
    "order",
    "issuedAt",
    "notBefore",
    "expiresAt",
    "licence",
    "hosting",
    "support",
    "agents",
    "alg",
    "kid",
    "sig"
  ],
  "properties": {
    "type": {
      "const": "entitlement/1"
    },
    "issuer": {
      "$ref": "#/$defs/issuer"
    },
    "subject": {
      "$ref": "common.schema.json#/$defs/contextId",
      "description": "Who is entitled: org:<orgId> or personal (DEC-0082). Never a person's id."
    },
    "estate": {
      "anyOf": [
        {
          "$ref": "activity-common.schema.json#/$defs/opaqueId"
        },
        {
          "type": "null"
        }
      ],
      "description": "For personal, the person's estate id: it binds a personal entitlement to one person's network without a cross-organization person id. null for org:<orgId>."
    },
    "order": {
      "type": "object",
      "required": [
        "id",
        "revision"
      ],
      "properties": {
        "id": {
          "$ref": "activity-common.schema.json#/$defs/opaqueId",
          "description": "The signed order's opaque id."
        },
        "revision": {
          "type": "integer",
          "minimum": 1,
          "maximum": 9007199254740991,
          "description": "The order's revision; a higher one supersedes a lower one of the same order."
        }
      },
      "additionalProperties": false
    },
    "issuedAt": {
      "$ref": "common.schema.json#/$defs/timestamp"
    },
    "notBefore": {
      "$ref": "common.schema.json#/$defs/timestamp",
      "description": "At or after issuedAt (FAC-SEM-115)."
    },
    "expiresAt": {
      "$ref": "common.schema.json#/$defs/timestamp",
      "description": "After notBefore and at most 35 days after issuedAt (FAC-SEM-115); 14 days of grace follow it."
    },
    "licence": {
      "anyOf": [
        {
          "type": "object",
          "required": [
            "members"
          ],
          "properties": {
            "members": {
              "type": "integer",
              "minimum": 1,
              "maximum": 1000000,
              "description": "The member allowance."
            }
          },
          "additionalProperties": false
        },
        {
          "type": "null"
        }
      ],
      "description": "The order's licence line, or null when it has none; always null for personal."
    },
    "hosting": {
      "anyOf": [
        {
          "type": "object",
          "required": [
            "product",
            "size"
          ],
          "properties": {
            "product": {
              "enum": [
                "org-cloud",
                "personal-cloud"
              ],
              "description": "org-cloud only for org:<orgId>, personal-cloud only for personal."
            },
            "size": {
              "$ref": "activity-common.schema.json#/$defs/opaqueId",
              "description": "The hosting size, an opaque id the issuer and the host agree on."
            }
          },
          "additionalProperties": false
        },
        {
          "type": "null"
        }
      ],
      "description": "The order's hosting line, or null when it has none."
    },
    "support": {
      "anyOf": [
        {
          "type": "object",
          "required": [
            "tier"
          ],
          "properties": {
            "tier": {
              "enum": [
                "observe",
                "assist",
                "managed"
              ],
              "description": "What the organization's admin agents may do, read from a verified record rather than from editable configuration."
            }
          },
          "additionalProperties": false
        },
        {
          "type": "null"
        }
      ],
      "description": "The order's support tier, or null; always null for personal."
    },
    "agents": {
      "type": "array",
      "maxItems": 256,
      "uniqueItems": true,
      "items": {
        "type": "object",
        "required": [
          "agentRef"
        ],
        "properties": {
          "agentRef": {
            "$ref": "fabric-package.schema.json#/$defs/agentRef"
          }
        },
        "additionalProperties": false
      },
      "description": "One entry per paid agent, unique by agentRef (FAC-SEM-115)."
    },
    "alg": {
      "enum": [
        "EdDSA"
      ],
      "description": "Ed25519 only; ES256 may join additively by a later decision."
    },
    "kid": {
      "$ref": "activity-common.schema.json#/$defs/opaqueId",
      "description": "The signing key's kid, as the issuer's current entitlement-key-set/1 lists it."
    },
    "sig": {
      "type": "string",
      "pattern": "^[A-Za-z0-9_-]{85}[AQgw]$",
      "description": "The Ed25519 signature (64 bytes, base64url without padding) over the UTF-8 RFC 8785 form of the document without sig."
    }
  },
  "additionalProperties": false,
  "allOf": [
    {
      "if": {
        "type": "object",
        "properties": {
          "subject": {
            "const": "personal"
          }
        },
        "required": [
          "subject"
        ]
      },
      "then": {
        "type": "object",
        "properties": {
          "estate": {
            "type": "string"
          },
          "licence": {
            "type": "null"
          },
          "support": {
            "type": "null"
          },
          "hosting": {
            "anyOf": [
              {
                "type": "null"
              },
              {
                "type": "object",
                "properties": {
                  "product": {
                    "const": "personal-cloud"
                  }
                }
              }
            ]
          }
        }
      },
      "else": {
        "type": "object",
        "properties": {
          "estate": {
            "type": "null"
          },
          "hosting": {
            "anyOf": [
              {
                "type": "null"
              },
              {
                "type": "object",
                "properties": {
                  "product": {
                    "const": "org-cloud"
                  }
                }
              }
            ]
          }
        }
      }
    }
  ],
  "$defs": {
    "issuer": {
      "type": "string",
      "maxLength": 261,
      "pattern": "^https://(?:[a-z0-9](?:[a-z0-9-]{0,61}[a-z0-9])?\\.)+[a-z0-9](?:[a-z0-9-]{0,61}[a-z0-9])?$",
      "description": "The issuer's https:// origin in lower case: a host of at least two labels, no port, no path, no trailing slash. Compared as written."
    }
  }
}
