{
  "type": "entitlement/1",
  "issuer": "https://platform.example",
  "subject": "personal",
  "estate": "estate-5d0f1a",
  "order": {
    "id": "ord-p-0001",
    "revision": 1
  },
  "issuedAt": "2026-10-20T00:00:00Z",
  "notBefore": "2026-10-20T00:00:00Z",
  "expiresAt": "2026-11-24T00:00:00Z",
  "licence": null,
  "hosting": {
    "product": "personal-cloud",
    "size": "p-1"
  },
  "support": null,
  "agents": [
    {
      "agentRef": "urn:fabric:agent:example-publisher:notes"
    },
    {
      "agentRef": "urn:fabric:agent:example-publisher:triage"
    }
  ],
  "alg": "EdDSA",
  "kid": "ent-2026-10",
  "sig": "zWUNfNb3u5f5G9L-cpLsVyUH8TfKmlODPteQpsGdLWA5d4Iw-B_aYtokLxejrlsfBVOap7-ZJ0TbJ3uEkbaFCg"
}
